475;"EM QUANTO TEMPO SE RENOVA A PRESIDÊNCIA DO CONSELHO DE MINISTROS DA UNIÃO EUROPÉIA?";"TRÊS MESES";"SEIS MESES";"NOVE MESES";"DOZE MESES";"2"
476;"QUAL PAÍS SUL-AMERICANO SE CHAMAVA PROVÍNCIA CISPLATINA ?";"CHILE";"COLÔMBIA";"URUGUAI";"EQUADOR";"3"
477;"EM QUE SÉCULO O TAJ MAHAL NA ÍNDIA FOI CONSTRUIDO ?";"SÉCULO VII";"SÉCULO VIII";"SÉCULO IX";"SÉCULO X";"1"
478;"DE QUE PAÍS A INDONÉSIA SE TORNOU INDEPENDENTE EM 1949 ?";"AUSTRÁLIA";"HOLANDA";"ÍNDIA";"ÁFRICA DO SUL";"2"
479;"QUAL FOI O PRIMEIRO PAÍS NO MUNDO A DAR DIREITO DE VOTO ÀS MULHERES ?";"ESTADOS UNIDOS";"FRANÇA";"NOVA ZELÂNDIA";"INGLATERRA";"3"
480;"ONDE NASCEU A GRANDE CANTORA DE ÓPERAS MARIA CALLAS ?";"ROMA";"NOVA YORK";"PARÍS";"ATENAS";"2"
481;"QUAL CIDADE DA EUROPA SEDIOU O TRATADO DA COMUNIDADE EUROPÉIA EM 1992?";"ZURIQUE";"BERLIM";"PARIS";"MAASTRICHT";"4"
482;"QUAL ERA A NACIONALIDADE DO ESCRITOR OSCAR WILDE ?";"IRLANDÊS";"ALEMÃO";"INGLÊS";"AMERICANO";"1"
483;"EM QUE CONTINENTE SE LOCALIZA A MONTANHA DE KILIMANJARO ?";"AMÉRICA DO NORTE";"ASIA";"EUROPA";"ÁFRICA";"4"
484;"O ESTREITO DE GIBRALTAR FICA ENTRE:";"NORUEGA E DINAMARCA";"ESPANHA E MARROCOS";"PORTUGAL E ESPANHA";"SUIÇA E SUÉCIA";"2"
485;"QUANTOS DENTES DE LEITE TEM O SER HUMANO QUANDO CRIANÇA ?";"32";"25";"20";"18";"3"
486;"QUANTO OSSOS TEM O CORPO HUMANO ?";"206";"205";"208";"207";"1"
487;"QUANTO TEMPO EM MÉDIA, VIVE UMA BARATA DE ESGOTO ?";"1 MÊS";"6 MESES";"1 ANO E MEIO";"2 ANOS E MEIO";"4"
488;"QUANTOS PARES DE CROMOSSOMOS POSSUI O SER HUMANO.";"22";"23";"24";"25";"2"
489;"QUAL DAS SEGUINTES PALAVRAS NÃO É UM SINÔNIMO DE 'MERMAR' ?";"DESCREVER";"DIMINUIR";"MINGUAR";"AUMENTAR";"4"
490;"QUEM É CONSIDERADO FUNDADOR DA LINGÜÍSTICA MODERNA?";"HORASE SAUSSURE";"BENOITE SAUSSURE";"NÍCOLAS SAUSSURE";"FERDINAND SAUSSURE";"4"
491;"EM QUE ANO OS MUÇULMANOS INVADIRAM A PENÍNSULA IBÉRICA?";"620";"750";"711";"1080";"3"
492;"O QUE É O ' NOTOCÓRDIO ' ?";"CORDÃO CELULAR";"BICO DAS AVES";"UM TIPO DE ALAÚDE";"UM MÁRTIR";"1"
493;"COMO SE CHAMAVA A SUBDIVISÃO ADMINISTRATIVA NA URBE ROMANA?";"CÚRIA";"CENTÚRIA";"DISTRITO";"DIOCESE";"1"
494;"A QUE ELEMENTO QUÍMICO DA TABELA PERIÓDICA CORRESPONDE O SÍMBOLO ' Tb'?";"TÉRBIO";"TURÍBIO";"TALÍO";"TANABASIO";"1"
495;"QUAL A CIÊNCIA QUE ESTUDA A DISTRIBUIÇÃO DOS SERES QUE VIVEM SOBRE A TERRA ?";"ZOOMETRIA";"ZOOLOGIA";"ZOOGEOGRAFIA";"ZOOTECNIA";"3"
496;"QUAL ERA A NACIONALIDADE DO PALHAÇO CHARLIE RIVEL?";"INGLESA";"AMERICANA";"FRANCESA";"ESPANHOLA";"4"
497;"ONDE ACONTECEU O PIOR TERREMOTO DA HISTÓRIA EM 28 DE JULHO DE 1927 ?";"LOS ANGELES";"INDIA";"CHINA";"ÁFRICA";"3"
498;"QUEM FOI O RESPONSÁVEL PELA IMPLANTAÇÃO DO REGIME COMUNISTA NA CHINA ?";"CHE GUEVARA";"KARL MARX";"MAO TSE TUNG";"HO CHI MING";"3"
499;"O QUE É UM NÚMERO PRIMO ?";"UM NUMERO PAR DIVISIVEL POR SI";"UM NÚMERO DIVISIVEL POR SI E PELA UNIDADE";"UM NÚMERO DIVISIVEL PELA UNIDADE E PELO SEU MULTIPLO";"UM NUMERO IMPAR DIVISIVEL PELA UNIDADE";"2"
500;"QUANTOS BITS TEM UM BYTE ?";"1024";"2048";"7";"8";"4"
